{
  "schemaVersion": 1,
  "apiVersion": 1,
  "id": "com.yycam.widget.pandalive",
  "revision": "2026.09.30.2",
  "name": "PandaLive",
  "description": "PandaLive broadcast overlay",
  "icon": {
    "url": "https://raw.githubusercontent.com/enefry/live_inject_helper/refs/heads/master/pandalive/pandalive.png"
  },
  "main": {
    "url": "https://www.pandalive.co.kr/",
    "allowedOrigins": [
      "https://pandalive.co.kr",
      "https://*.pandalive.co.kr"
    ],
    "inject": {
      "js": [
        {
          "id": "pandalive-main",
          "url": "https://raw.githubusercontent.com/enefry/live_inject_helper/refs/heads/master/pandalive/pandalive.js",
          "integrity": "sha256-/Umij4fLKivp8wWZD00rRASch2EnT4h6A66hbO4k7Bw=",
          "injectionTime": "documentEnd"
        }
      ],
      "css": [
        {
          "id": "pandalive-main-style",
          "url": "https://raw.githubusercontent.com/enefry/live_inject_helper/refs/heads/master/pandalive/pandalive.css",
          "integrity": "sha256-Dq9DlaHM/XbJSc2Jg/EyRHIbVIxpXpZ6NGmIvTB1mak=",
          "injectionTime": "documentEnd"
        }
      ]
    },
    "runtime": {
      "methods": [
        "configuration.status"
      ]
    }
  },
  "configs": {
    "default": {
      "title": "PandaLive account settings",
      "description": "Sign in to PandaLive before using the overlay.",
      "url": "https://www.pandalive.co.kr/my/modify",
      "allowedOrigins": [
        "https://pandalive.co.kr",
        "https://*.pandalive.co.kr"
      ],
      "inject": {
        "js": [
          {
            "id": "pandalive-config-default",
            "url": "https://raw.githubusercontent.com/enefry/live_inject_helper/refs/heads/master/pandalive/pandalive_broadcast.js",
            "integrity": "sha256-Q+ZUhsNNTnK2BdAnd7QfW+zfQxF/qNB5colU+SlbRD8=",
            "injectionTime": "documentEnd"
          }
        ],
        "css": [
          {
            "id": "pandalive-config-default-style",
            "url": "https://raw.githubusercontent.com/enefry/live_inject_helper/refs/heads/master/pandalive/pandalive_broadcast.css",
            "integrity": "sha256-JWur0LVJU9uVk1nQx097QhL8ClWnXGeKnva6VDB1x0A=",
            "injectionTime": "documentEnd"
          }
        ]
      }
    }
  }
}
